PMID,Title,Authors,Citation,First Author,Journal/Book,Publication Year,Create Date,PMCID,NIHMS ID,DOI
"29865927","Non-coding RNAs in virology: an RNA genomics approach","Isaac C, Patel TR, Zovoilis A.","Biotechnol Genet Eng Rev. 2018 Apr;34(1):90-106. doi: 10.1080/02648725.2018.1471642. Epub 2018 Jun 4.","Isaac C","Biotechnol Genet Eng Rev","2018","2018/06/06","","","10.1080/02648725.2018.1471642"
"35832805","Genomic Characterization of Enterococcus hirae From Beef Cattle Feedlots and Associated Environmental Continuum","Zaidi SE, Zaheer R, Barbieri R, Cook SR, Hannon SJ, Booker CW, Church D, Van Domselaar G, Zovoilis A, McAllister TA.","Front Microbiol. 2022 Jun 27;13:859990. doi: 10.3389/fmicb.2022.859990. eCollection 2022.","Zaidi SE","Front Microbiol","2022","2022/07/14","PMC9271880","","10.3389/fmicb.2022.859990"
"33901984","Mechanism of copper nanoparticle toxicity in rainbow trout olfactory mucosa","Razmara P, Imbery JJ, Koide E, Helbing CC, Wiseman SB, Gauthier PT, Bray DF, Needham M, Haight T, Zovoilis A, Pyle GG.","Environ Pollut. 2021 Sep 1;284:117141. doi: 10.1016/j.envpol.2021.117141. Epub 2021 Apr 16.","Razmara P","Environ Pollut","2021","2021/04/26","","","10.1016/j.envpol.2021.117141"
"33645898","Increased Alu RNA processing in Alzheimer brains is linked to gene expression changes","Cheng Y, Saville L, Gollen B, Veronesi AA, Mohajerani M, Joseph JT, Zovoilis A.","EMBO Rep. 2021 May 5;22(5):e52255. doi: 10.15252/embr.202052255. Epub 2021 Mar 1.","Cheng Y","EMBO Rep","2021","2021/03/01","PMC8097388","","10.15252/embr.202052255"
"21946562","microRNA-34c is a novel target to treat dementias","Zovoilis A, Agbemenyah HY, Agis-Balboa RC, Stilling RM, Edbauer D, Rao P, Farinelli L, Delalle I, Schmitt A, Falkai P, Bahari-Javan S, Burkhardt S, Sananbenesi F, Fischer A.","EMBO J. 2011 Sep 23;30(20):4299-308. doi: 10.1038/emboj.2011.327.","Zovoilis A","EMBO J","2011","2011/09/28","PMC3199394","","10.1038/emboj.2011.327"
"31871160","B2 and ALU retrotransposons are self-cleaving ribozymes whose activity is enhanced by EZH2","Hernandez AJ, Zovoilis A, Cifuentes-Rojas C, Han L, Bujisic B, Lee JT.","Proc Natl Acad Sci U S A. 2020 Jan 7;117(1):415-425. doi: 10.1073/pnas.1917190117. Epub 2019 Dec 23.","Hernandez AJ","Proc Natl Acad Sci U S A","2020","2019/12/25","PMC6955291","","10.1073/pnas.1917190117"
"27984727","Destabilization of B2 RNA by EZH2 Activates the Stress Response","Zovoilis A, Cifuentes-Rojas C, Chu HP, Hernandez AJ, Lee JT.","Cell. 2016 Dec 15;167(7):1788-1802.e13. doi: 10.1016/j.cell.2016.11.041.","Zovoilis A","Cell","2016","2016/12/17","PMC5552366","NIHMS884254","10.1016/j.cell.2016.11.041"
"23007512","Vector-free methods for manipulating miRNA activity in vitro and in vivo","Pantazi A, Zovoilis A.","Methods Mol Biol. 2013;936:231-45. doi: 10.1007/978-1-62703-083-0_18.","Pantazi A","Methods Mol Biol","2013","2012/09/26","","","10.1007/978-1-62703-083-0_18"
"33123915","Depletion of eukaryotic initiation factor 5B (eIF5B) reprograms the cellular transcriptome and leads to activation of endoplasmic reticulum (ER) stress and c-Jun N-terminal kinase (JNK)","Bressler KR, Ross JA, Ilnytskyy S, Vanden Dungen K, Taylor K, Patel K, Zovoilis A, Kovalchuk I, Thakor N.","Cell Stress Chaperones. 2021 Jan;26(1):253-264. doi: 10.1007/s12192-020-01174-1. Epub 2020 Oct 29.","Bressler KR","Cell Stress Chaperones","2021","2020/10/30","PMC7736443","","10.1007/s12192-020-01174-1"
"33191914","Increased processing of SINE B2 ncRNAs unveils a novel type of transcriptome deregulation in amyloid beta neuropathology","Cheng Y, Saville L, Gollen B, Isaac C, Belay A, Mehla J, Patel K, Thakor N, Mohajerani MH, Zovoilis A.","Elife. 2020 Nov 16;9:e61265. doi: 10.7554/eLife.61265.","Cheng Y","Elife","2020","2020/11/16","PMC7717908","","10.7554/eLife.61265"
"20448184","Altered histone acetylation is associated with age-dependent memory impairment in mice","Peleg S, Sananbenesi F, Zovoilis A, Burkhardt S, Bahari-Javan S, Agis-Balboa RC, Cota P, Wittnam JL, Gogol-Doering A, Opitz L, Salinas-Riester G, Dettenhofer M, Kang H, Farinelli L, Chen W, Fischer A.","Science. 2010 May 7;328(5979):753-6. doi: 10.1126/science.1186088.","Peleg S","Science","2010","2010/05/08","","","10.1126/science.1186088"
"21873981","A hippocampal insulin-growth factor 2 pathway regulates the extinction of fear memories","Agis-Balboa RC, Arcos-Diaz D, Wittnam J, Govindarajan N, Blom K, Burkhardt S, Haladyniak U, Agbemenyah HY, Zovoilis A, Salinas-Riester G, Opitz L, Sananbenesi F, Fischer A.","EMBO J. 2011 Aug 26;30(19):4071-83. doi: 10.1038/emboj.2011.293.","Agis-Balboa RC","EMBO J","2011","2011/08/30","PMC3209781","","10.1038/emboj.2011.293"
"21454525","MicroRNA cluster 302-367 enhances somatic cell reprogramming by accelerating a mesenchymal-to-epithelial transition","Liao B, Bao X, Liu L, Feng S, Zovoilis A, Liu W, Xue Y, Cai J, Guo X, Qin B, Zhang R, Wu J, Lai L, Teng M, Niu L, Zhang B, Esteban MA, Pei D.","J Biol Chem. 2011 May 13;286(19):17359-64. doi: 10.1074/jbc.C111.235960. Epub 2011 Mar 22.","Liao B","J Biol Chem","2011","2011/04/02","PMC3089577","","10.1074/jbc.C111.235960"
"19628328","Members of the miR-290 cluster modulate in vitro differentiation of mouse embryonic stem cells","Zovoilis A, Smorag L, Pantazi A, Engel W.","Differentiation. 2009 Sep-Oct;78(2-3):69-78. doi: 10.1016/j.diff.2009.06.003. Epub 2009 Jul 22.","Zovoilis A","Differentiation","2009","2009/07/25","","","10.1016/j.diff.2009.06.003"
"32673383","Application of artificial intelligence to the in silico assessment of antimicrobial resistance and risks to human and animal health presented by priority enteric bacterial pathogens","Steinkey R, Moat J, Gannon V, Zovoilis A, Laing C.","Can Commun Dis Rep. 2020 Jun 4;46(6):180-185. doi: 10.14745/ccdr.v46i06a05. eCollection 2020 Jun 4.","Steinkey R","Can Commun Dis Rep","2020","2020/07/17","PMC7343051","","10.14745/ccdr.v46i06a05"
"18697907","Multipotent adult germline stem cells and embryonic stem cells have similar microRNA profiles","Zovoilis A, Nolte J, Drusenheimer N, Zechner U, Hada H, Guan K, Hasenfuss G, Nayernia K, Engel W.","Mol Hum Reprod. 2008 Sep;14(9):521-9. doi: 10.1093/molehr/gan044. Epub 2008 Aug 12.","Zovoilis A","Mol Hum Reprod","2008","2008/08/14","","","10.1093/molehr/gan044"
"19297418","Comparative methylation profiles and telomerase biology of mouse multipotent adult germline stem cells and embryonic stem cells","Zechner U, Nolte J, Wolf M, Shirneshan K, Hajj NE, Weise D, Kaltwasser B, Zovoilis A, Haaf T, Engel W.","Mol Hum Reprod. 2009 Jun;15(6):345-53. doi: 10.1093/molehr/gap023. Epub 2009 Mar 18.","Zechner U","Mol Hum Reprod","2009","2009/03/20","","","10.1093/molehr/gap023"
"20566704","Embryonic stem cell-related miRNAs are involved in differentiation of pluripotent cells originating from the germ line","Zovoilis A, Pantazi A, Smorag L, Opitz L, Riester GS, Wolf M, Zechner U, Holubowska A, Stewart CL, Engel W.","Mol Hum Reprod. 2010 Nov;16(11):793-803. doi: 10.1093/molehr/gaq053. Epub 2010 Jun 21.","Zovoilis A","Mol Hum Reprod","2010","2010/06/23","","","10.1093/molehr/gaq053"
"24534129","The expression level of small non-coding RNAs derived from the first exon of protein-coding genes is predictive of cancer status","Zovoilis A, Mungall AJ, Moore R, Varhol R, Chu A, Wong T, Marra M, Jones SJ.","EMBO Rep. 2014 Apr;15(4):402-10. doi: 10.1002/embr.201337950. Epub 2014 Feb 17.","Zovoilis A","EMBO Rep","2014","2014/02/19","PMC3989671","","10.1002/embr.201337950"
