PMID,Title,Authors,Citation,First Author,Journal/Book,Publication Year,Create Date,PMCID,NIHMS ID,DOI
"31811637","Lessons from (pre-)mRNA Imaging","Adivarahan S, Zenklusen D.","Adv Exp Med Biol. 2019;1203:247-284. doi: 10.1007/978-3-030-31434-7_9.","Adivarahan S","Adv Exp Med Biol","2019","2019/12/08","","","10.1007/978-3-030-31434-7_9"
"19416065","Imaging transcription in living cells","Darzacq X, Yao J, Larson DR, Causse SZ, Bosanac L, de Turris V, Ruda VM, Lionnet T, Zenklusen D, Guglielmi B, Tjian R, Singer RH.","Annu Rev Biophys. 2009;38:173-96. doi: 10.1146/annurev.biophys.050708.133728.","Darzacq X","Annu Rev Biophys","2009","2009/05/07","PMC3166783","NIHMS318257","10.1146/annurev.biophys.050708.133728"
"19819144","A single molecule view of gene expression","Larson DR, Singer RH, Zenklusen D.","Trends Cell Biol. 2009 Nov;19(11):630-7. doi: 10.1016/j.tcb.2009.08.008. Epub 2009 Oct 8.","Larson DR","Trends Cell Biol","2009","2009/10/13","PMC2783999","NIHMS142696","10.1016/j.tcb.2009.08.008"
"22387213","To the pore and through the pore: a story of mRNA export kinetics","Oeffinger M, Zenklusen D.","Biochim Biophys Acta. 2012 Jun;1819(6):494-506. doi: 10.1016/j.bbagrm.2012.02.011. Epub 2012 Feb 22.","Oeffinger M","Biochim Biophys Acta","2012","2012/03/06","PMC3345096","NIHMS360120","10.1016/j.bbagrm.2012.02.011"
"33201475","Probing the Conformational State of mRNPs Using smFISH and SIM","Adivarahan S, Zenklusen D.","Methods Mol Biol. 2021;2209:267-286. doi: 10.1007/978-1-0716-0935-4_17.","Adivarahan S","Methods Mol Biol","2021","2020/11/17","","","10.1007/978-1-0716-0935-4_17"
"14662358","RNA asymmetric distribution and daughter/mother differentiation in yeast","Darzacq X, Powrie E, Gu W, Singer RH, Zenklusen D.","Curr Opin Microbiol. 2003 Dec;6(6):614-20. doi: 10.1016/j.mib.2003.10.005.","Darzacq X","Curr Opin Microbiol","2003","2003/12/10","PMC4956921","NIHMS799975","10.1016/j.mib.2003.10.005"
"33938148","Choosing the right exit: How functional plasticity of the nuclear pore drives selective and efficient mRNA export","Bensidoun P, Zenklusen D, Oeffinger M.","Wiley Interdiscip Rev RNA. 2021 Nov;12(6):e1660. doi: 10.1002/wrna.1660. Epub 2021 May 2.","Bensidoun P","Wiley Interdiscip Rev RNA","2021","2021/05/03","","","10.1002/wrna.1660"
"35948369","Single-cell multi-omics of human preimplantation embryos shows susceptibility to glucocorticoids","Zhao C, Biondic S, Vandal K, Björklund ÅK, Hagemann-Jensen M, Sommer TM, Canizo J, Clark S, Raymond P, Zenklusen DR, Rivron N, Reik W, Petropoulos S.","Genome Res. 2022 Aug 10;32(9):1627-41. doi: 10.1101/gr.276665.122. Online ahead of print.","Zhao C","Genome Res","2022","2022/08/10","PMC9528977","","10.1101/gr.276665.122"
"31407282","Live-Cell Imaging of mRNP-NPC Interactions in Budding Yeast","Lari A, Farzam F, Bensidoun P, Oeffinger M, Zenklusen D, Grunwald D, Montpetit B.","Methods Mol Biol. 2019;2038:131-150. doi: 10.1007/978-1-4939-9674-2_9.","Lari A","Methods Mol Biol","2019","2019/08/14","PMC7392168","NIHMS1608774","10.1007/978-1-4939-9674-2_9"
"33547245","Stress granule formation, disassembly, and composition are regulated by alphavirus ADP-ribosylhydrolase activity","Jayabalan AK, Adivarahan S, Koppula A, Abraham R, Batish M, Zenklusen D, Griffin DE, Leung AKL.","Proc Natl Acad Sci U S A. 2021 Feb 9;118(6):e2021719118. doi: 10.1073/pnas.2021719118.","Jayabalan AK","Proc Natl Acad Sci U S A","2021","2021/02/06","PMC8017970","","10.1073/pnas.2021719118"
"36220102","Nuclear mRNA metabolism drives selective basket assembly on a subset of nuclear pore complexes in budding yeast","Bensidoun P, Reiter T, Montpetit B, Zenklusen D, Oeffinger M.","Mol Cell. 2022 Oct 20;82(20):3856-3871.e6. doi: 10.1016/j.molcel.2022.09.019. Epub 2022 Oct 10.","Bensidoun P","Mol Cell","2022","2022/10/11","","","10.1016/j.molcel.2022.09.019"
"29236250","Measuring mRNA Decay in Budding Yeast Using Single Molecule FISH","Trcek T, Rahman S, Zenklusen D.","Methods Mol Biol. 2018;1720:35-54. doi: 10.1007/978-1-4939-7540-2_4.","Trcek T","Methods Mol Biol","2018","2017/12/14","","","10.1007/978-1-4939-7540-2_4"
"30415950","Spatial Organization of Single mRNPs at Different Stages of the Gene Expression Pathway","Adivarahan S, Livingston N, Nicholson B, Rahman S, Wu B, Rissland OS, Zenklusen D.","Mol Cell. 2018 Nov 15;72(4):727-738.e5. doi: 10.1016/j.molcel.2018.10.010. Epub 2018 Nov 8.","Adivarahan S","Mol Cell","2018","2018/11/13","PMC6592633","NIHMS1511607","10.1016/j.molcel.2018.10.010"
"29941930","Senescence-associated ribosome biogenesis defects contributes to cell cycle arrest through the Rb pathway","Lessard F, Igelmann S, Trahan C, Huot G, Saint-Germain E, Mignacca L, Del Toro N, Lopes-Paciencia S, Le Calvé B, Montero M, Deschênes-Simard X, Bury M, Moiseeva O, Rowell MC, Zorca CE, Zenklusen D, Brakier-Gingras L, Bourdeau V, Oeffinger M, Ferbeyre G.","Nat Cell Biol. 2018 Jul;20(7):789-799. doi: 10.1038/s41556-018-0127-y. Epub 2018 Jun 25.","Lessard F","Nat Cell Biol","2018","2018/06/27","","","10.1038/s41556-018-0127-y"
"26017315","Promoter-Autonomous Functioning in a Controlled Environment using Single Molecule FISH","Hocine S, Vera M, Zenklusen D, Singer RH.","Sci Rep. 2015 May 28;5:9934. doi: 10.1038/srep09934.","Hocine S","Sci Rep","2015","2015/05/29","PMC4446897","","10.1038/srep09934"
"21356978","Imaging real-time gene expression in living yeast","Zenklusen D, Wells AL, Condeelis JS, Singer RH.","CSH Protoc. 2007 Nov 1;2007:pdb.prot4870. doi: 10.1101/pdb.prot4870.","Zenklusen D","CSH Protoc","2007","2011/03/02","PMC4956917","NIHMS802013","10.1101/pdb.prot4870"
"27839866","Structure and Function of the Nuclear Pore Complex Cytoplasmic mRNA Export Platform","Fernandez-Martinez J, Kim SJ, Shi Y, Upla P, Pellarin R, Gagnon M, Chemmama IE, Wang J, Nudelman I, Zhang W, Williams R, Rice WJ, Stokes DL, Zenklusen D, Chait BT, Sali A, Rout MP.","Cell. 2016 Nov 17;167(5):1215-1228.e25. doi: 10.1016/j.cell.2016.10.028. Epub 2016 Nov 10.","Fernandez-Martinez J","Cell","2016","2016/11/15","PMC5130164","NIHMS824291","10.1016/j.cell.2016.10.028"
"21131977","Transcription of functionally related constitutive genes is not coordinated","Gandhi SJ, Zenklusen D, Lionnet T, Singer RH.","Nat Struct Mol Biol. 2011 Jan;18(1):27-34. doi: 10.1038/nsmb.1934. Epub 2010 Dec 5.","Gandhi SJ","Nat Struct Mol Biol","2011","2010/12/07","PMC3058351","NIHMS237678","10.1038/nsmb.1934"
"22301778","Single-mRNA counting using fluorescent in situ hybridization in budding yeast","Trcek T, Chao JA, Larson DR, Park HY, Zenklusen D, Shenoy SM, Singer RH.","Nat Protoc. 2012 Feb 2;7(2):408-19. doi: 10.1038/nprot.2011.451.","Trcek T","Nat Protoc","2012","2012/02/04","PMC4112553","NIHMS605145","10.1038/nprot.2011.451"
"23263691","Single-molecule analysis of gene expression using two-color RNA labeling in live yeast","Hocine S, Raymond P, Zenklusen D, Chao JA, Singer RH.","Nat Methods. 2013 Feb;10(2):119-21. doi: 10.1038/nmeth.2305. Epub 2012 Dec 23.","Hocine S","Nat Methods","2013","2012/12/25","PMC3899799","NIHMS544978","10.1038/nmeth.2305"
"23770821","Bimodal expression of PHO84 is modulated by early termination of antisense transcription","Castelnuovo M, Rahman S, Guffanti E, Infantino V, Stutz F, Zenklusen D.","Nat Struct Mol Biol. 2013 Jul;20(7):851-8. doi: 10.1038/nsmb.2598. Epub 2013 Jun 16.","Castelnuovo M","Nat Struct Mol Biol","2013","2013/06/18","PMC4972572","CAMS4085","10.1038/nsmb.2598"
"23979998","Single-molecule resolution fluorescent in situ hybridization (smFISH) in the yeast S. cerevisiae","Rahman S, Zenklusen D.","Methods Mol Biol. 2013;1042:33-46. doi: 10.1007/978-1-62703-526-2_3.","Rahman S","Methods Mol Biol","2013","2013/08/28","","","10.1007/978-1-62703-526-2_3"
"26694838","The nuclear basket mediates perinuclear mRNA scanning in budding yeast","Saroufim MA, Bensidoun P, Raymond P, Rahman S, Krause MR, Oeffinger M, Zenklusen D.","J Cell Biol. 2015 Dec 21;211(6):1131-40. doi: 10.1083/jcb.201503070.","Saroufim MA","J Cell Biol","2015","2015/12/24","PMC4687876","","10.1083/jcb.201503070"
"21512033","Real-time observation of transcription initiation and elongation on an endogenous yeast gene","Larson DR, Zenklusen D, Wu B, Chao JA, Singer RH.","Science. 2011 Apr 22;332(6028):475-8. doi: 10.1126/science.1202142.","Larson DR","Science","2011","2011/04/23","PMC3152976","NIHMS314189","10.1126/science.1202142"
"29069457","Nol12 is a multifunctional RNA binding protein at the nexus of RNA and DNA metabolism","Scott DD, Trahan C, Zindy PJ, Aguilar LC, Delubac MY, Van Nostrand EL, Adivarahan S, Wei KE, Yeo GW, Zenklusen D, Oeffinger M.","Nucleic Acids Res. 2017 Dec 1;45(21):12509-12528. doi: 10.1093/nar/gkx963.","Scott DD","Nucleic Acids Res","2017","2017/10/26","PMC5716212","","10.1093/nar/gkx963"
"23706744","A nutrient-responsive pathway that determines M phase timing through control of B-cyclin mRNA stability","Messier V, Zenklusen D, Michnick SW.","Cell. 2013 May 23;153(5):1080-93. doi: 10.1016/j.cell.2013.04.035.","Messier V","Cell","2013","2013/05/28","","","10.1016/j.cell.2013.04.035"
"20946829","Analyzing mRNA expression using single mRNA resolution fluorescent in situ hybridization","Zenklusen D, Singer RH.","Methods Enzymol. 2010;470:641-59. doi: 10.1016/S0076-6879(10)70026-4. Epub 2010 Mar 1.","Zenklusen D","Methods Enzymol","2010","2010/10/16","PMC3162037","NIHMS318095","10.1016/S0076-6879(10)70026-4"
"25770220","Myosin VI regulates gene pairing and transcriptional pause release in T cells","Zorca CE, Kim LK, Kim YJ, Krause MR, Zenklusen D, Spilianakis CG, Flavell RA.","Proc Natl Acad Sci U S A. 2015 Mar 31;112(13):E1587-93. doi: 10.1073/pnas.1502461112. Epub 2015 Mar 13.","Zorca CE","Proc Natl Acad Sci U S A","2015","2015/03/15","PMC4386387","","10.1073/pnas.1502461112"
"26784711","Imaging single mRNAs to study dynamics of mRNA export in the yeast Saccharomyces cerevisiae","Bensidoun P, Raymond P, Oeffinger M, Zenklusen D.","Methods. 2016 Apr 1;98:104-114. doi: 10.1016/j.ymeth.2016.01.006. Epub 2016 Jan 16.","Bensidoun P","Methods","2016","2016/01/20","","","10.1016/j.ymeth.2016.01.006"
"27932455","Single-cell profiling reveals that eRNA accumulation at enhancer-promoter loops is not required to sustain transcription","Rahman S, Zorca CE, Traboulsi T, Noutahi E, Krause MR, Mader S, Zenklusen D.","Nucleic Acids Res. 2017 Apr 7;45(6):3017-3030. doi: 10.1093/nar/gkw1220.","Rahman S","Nucleic Acids Res","2017","2016/12/10","PMC5389544","","10.1093/nar/gkw1220"
"17317628","YRA1 autoregulation requires nuclear export and cytoplasmic Edc3p-mediated degradation of its pre-mRNA","Dong S, Li C, Zenklusen D, Singer RH, Jacobson A, He F.","Mol Cell. 2007 Feb 23;25(4):559-73. doi: 10.1016/j.molcel.2007.01.012.","Dong S","Mol Cell","2007","2007/02/24","PMC1858660","NIHMS18882","10.1016/j.molcel.2007.01.012"
"21356977","Imaging real-time gene expression in Mammalian cells with single-transcript resolution","Wells AL, Condeelis JS, Singer RH, Zenklusen D.","CSH Protoc. 2007 Nov 1;2007:pdb.prot4869. doi: 10.1101/pdb.prot4869.","Wells AL","CSH Protoc","2007","2011/03/02","PMC4949394","NIHMS802014","10.1101/pdb.prot4869"
"19011635","Single-RNA counting reveals alternative modes of gene expression in yeast","Zenklusen D, Larson DR, Singer RH.","Nat Struct Mol Biol. 2008 Dec;15(12):1263-71. doi: 10.1038/nsmb.1514. Epub 2008 Nov 16.","Zenklusen D","Nat Struct Mol Biol","2008","2008/11/18","PMC3154325","NIHMS314191","10.1038/nsmb.1514"
"20335538","Metabolic cycling in single yeast cells from unsynchronized steady-state populations limited on glucose or phosphate","Silverman SJ, Petti AA, Slavov N, Parsons L, Briehof R, Thiberge SY, Zenklusen D, Gandhi SJ, Larson DR, Singer RH, Botstein D.","Proc Natl Acad Sci U S A. 2010 Apr 13;107(15):6946-51. doi: 10.1073/pnas.1002422107. Epub 2010 Mar 24.","Silverman SJ","Proc Natl Acad Sci U S A","2010","2010/03/26","PMC2872461","","10.1073/pnas.1002422107"
"26694837","In vivo single-particle imaging of nuclear mRNA export in budding yeast demonstrates an essential role for Mex67p","Smith C, Lari A, Derrer CP, Ouwehand A, Rossouw A, Huisman M, Dange T, Hopman M, Joseph A, Zenklusen D, Weis K, Grunwald D, Montpetit B.","J Cell Biol. 2015 Dec 21;211(6):1121-30. doi: 10.1083/jcb.201503135.","Smith C","J Cell Biol","2015","2015/12/24","PMC4687877","","10.1083/jcb.201503135"
"12192043","Coupling of termination, 3' processing, and mRNA export","Hammell CM, Gross S, Zenklusen D, Heath CV, Stutz F, Moore C, Cole CN.","Mol Cell Biol. 2002 Sep;22(18):6441-57. doi: 10.1128/MCB.22.18.6441-6457.2002.","Hammell CM","Mol Cell Biol","2002","2002/08/23","PMC135649","","10.1128/MCB.22.18.6441-6457.2002"
"20005841","Rrp17p is a eukaryotic exonuclease required for 5' end processing of Pre-60S ribosomal RNA","Oeffinger M, Zenklusen D, Ferguson A, Wei KE, El Hage A, Tollervey D, Chait BT, Singer RH, Rout MP.","Mol Cell. 2009 Dec 11;36(5):768-81. doi: 10.1016/j.molcel.2009.11.011.","Oeffinger M","Mol Cell","2009","2009/12/17","PMC2806520","","10.1016/j.molcel.2009.11.011"
"21036941","A nucleoporin, Nup60p, affects the nuclear and cytoplasmic localization of ASH1 mRNA in S. cerevisiae","Powrie EA, Zenklusen D, Singer RH.","RNA. 2011 Jan;17(1):134-44. doi: 10.1261/rna.1210411. Epub 2010 Oct 29.","Powrie EA","RNA","2011","2010/11/02","PMC3004054","","10.1261/rna.1210411"
"28949905","Visualization of the lymphocytic choriomeningitis mammarenavirus (LCMV) genome reveals the early endosome as a possible site for genome replication and viral particle &nbsp;pre-assembly","King BR, Kellner S, Eisenhauer PL, Bruce EA, Ziegler CM, Zenklusen D, Botten JW.","J Gen Virol. 2017 Oct;98(10):2454-2460. doi: 10.1099/jgv.0.000930.","King BR","J Gen Virol","2017","2017/09/27","PMC5725993","","10.1099/jgv.0.000930"
"21356986","Imaging real-time gene expression in living systems with single-transcript resolution: construct design and imaging system setup","Wells AL, Condeelis JS, Singer RH, Zenklusen D.","CSH Protoc. 2007 Nov 1;2007:pdb.top28. doi: 10.1101/pdb.top28.","Wells AL","CSH Protoc","2007","2011/03/02","PMC4956922","NIHMS802010","10.1101/pdb.top28"
"15537539","She2p is a novel RNA binding protein with a basic helical hairpin motif","Niessing D, Hüttelmaier S, Zenklusen D, Singer RH, Burley SK.","Cell. 2004 Nov 12;119(4):491-502. doi: 10.1016/j.cell.2004.10.018.","Niessing D","Cell","2004","2004/11/13","","","10.1016/j.cell.2004.10.018"
"16306994","Spatial regulation of beta-actin translation by Src-dependent phosphorylation of ZBP1","Hüttelmaier S, Zenklusen D, Lederer M, Dictenberg J, Lorenz M, Meng X, Bassell GJ, Condeelis J, Singer RH.","Nature. 2005 Nov 24;438(7067):512-5. doi: 10.1038/nature04115.","Hüttelmaier S","Nature","2005","2005/11/25","","","10.1038/nature04115"
"21356980","Imaging Real-Time Gene Expression in Living Systems with Single-Transcript Resolution: Single mRNA Particle Tracking with ImageJ-Based Analysis","Wells AL, Condeelis JS, Singer RH, Zenklusen D.","CSH Protoc. 2007 Nov 1;2007:pdb.prot4872. doi: 10.1101/pdb.prot4872.","Wells AL","CSH Protoc","2007","2011/03/02","PMC4963622","NIHMS802011","10.1101/pdb.prot4872"
"15692572","Perinuclear Mlp proteins downregulate gene expression in response to a defect in mRNA export","Vinciguerra P, Iglesias N, Camblong J, Zenklusen D, Stutz F.","EMBO J. 2005 Feb 23;24(4):813-23. doi: 10.1038/sj.emboj.7600527. Epub 2005 Feb 3.","Vinciguerra P","EMBO J","2005","2005/02/05","PMC549612","","10.1038/sj.emboj.7600527"
"21356979","Imaging real-time gene expression in living systems with single-transcript resolution: image analysis of single mRNA transcripts","Wells AL, Condeelis JS, Singer RH, Zenklusen D.","CSH Protoc. 2007 Nov 1;2007:pdb.prot4871. doi: 10.1101/pdb.prot4871.","Wells AL","CSH Protoc","2007","2011/03/02","PMC4947526","NIHMS802012","10.1101/pdb.prot4871"
"29643234","Visualization of Arenavirus RNA Species in Individual Cells by Single-Molecule Fluorescence In Situ Hybridization Suggests a Model of Cyclical Infection and Clearance during Persistence","King BR, Samacoits A, Eisenhauer PL, Ziegler CM, Bruce EA, Zenklusen D, Zimmer C, Mueller F, Botten J.","J Virol. 2018 May 29;92(12):e02241-17. doi: 10.1128/JVI.02241-17. Print 2018 Jun 15.","King BR","J Virol","2018","2018/04/13","PMC5974494","","10.1128/JVI.02241-17"
"15198983","A new yeast PUF family protein, Puf6p, represses ASH1 mRNA translation and is required for its localization","Gu W, Deng Y, Zenklusen D, Singer RH.","Genes Dev. 2004 Jun 15;18(12):1452-65. doi: 10.1101/gad.1189004.","Gu W","Genes Dev","2004","2004/06/17","PMC423195","","10.1101/gad.1189004"
"12417727","Stable mRNP formation and export require cotranscriptional recruitment of the mRNA export factors Yra1p and Sub2p by Hpr1p","Zenklusen D, Vinciguerra P, Wyss JC, Stutz F.","Mol Cell Biol. 2002 Dec;22(23):8241-53. doi: 10.1128/MCB.22.23.8241-8253.2002.","Zenklusen D","Mol Cell Biol","2002","2002/11/06","PMC134069","","10.1128/MCB.22.23.8241-8253.2002"
