PMID,Title,Authors,Citation,First Author,Journal/Book,Publication Year,Create Date,PMCID,NIHMS ID,DOI
"25988717","Translational regulation in chloroplasts for development and homeostasis","Sun Y, Zerges W.","Biochim Biophys Acta. 2015 Sep;1847(9):809-20. doi: 10.1016/j.bbabio.2015.05.008. Epub 2015 May 16.","Sun Y","Biochim Biophys Acta","2015","2015/05/20","","","10.1016/j.bbabio.2015.05.008"
"11950614","Does complexity constrain organelle evolution?","Zerges W.","Trends Plant Sci. 2002 Apr;7(4):175-82. doi: 10.1016/s1360-1385(02)02233-1.","Zerges W","Trends Plant Sci","2002","2002/04/16","","","10.1016/s1360-1385(02)02233-1"
"36373798","An RNA granule for translation quality control in Saccharomyces cerevisiae","Dhaliwal JS, Panozzo C, Benard L, Zerges W.","J Cell Sci. 2022 Dec 1;135(23):jcs260388. doi: 10.1242/jcs.260388. Epub 2022 Dec 7.","Dhaliwal JS","J Cell Sci","2022","2022/11/14","","","10.1242/jcs.260388"
"23457718","Protein targeting to subcellular organelles via MRNA localization","Weis BL, Schleiff E, Zerges W.","Biochim Biophys Acta. 2013 Feb;1833(2):260-73. doi: 10.1016/j.bbamcr.2012.04.004.","Weis BL","Biochim Biophys Acta","2013","2013/03/05","","","10.1016/j.bbamcr.2012.04.004"
"26449969","Localized control of oxidized RNA","Zhan Y, Dhaliwal JS, Adjibade P, Uniacke J, Mazroui R, Zerges W.","J Cell Sci. 2015 Nov 15;128(22):4210-9. doi: 10.1242/jcs.175232. Epub 2015 Oct 8.","Zhan Y","J Cell Sci","2015","2015/10/10","","","10.1242/jcs.175232"
"34175518","Mixtures of rare earth elements show antagonistic interactions in Chlamydomonas reinhardtii","Morel E, Cui L, Zerges W, Wilkinson KJ.","Environ Pollut. 2021 Oct 15;287:117594. doi: 10.1016/j.envpol.2021.117594. Epub 2021 Jun 14.","Morel E","Environ Pollut","2021","2021/06/27","","","10.1016/j.envpol.2021.117594"
"21431732","FISH and immunofluorescence staining in Chlamydomonas","Uniacke J, Colón-Ramos D, Zerges W.","Methods Mol Biol. 2011;714:15-29. doi: 10.1007/978-1-61779-005-8_2.","Uniacke J","Methods Mol Biol","2011","2011/03/25","","","10.1007/978-1-61779-005-8_2"
"29481573","Pyrenoid functions revealed by proteomics in Chlamydomonas reinhardtii","Zhan Y, Marchand CH, Maes A, Mauries A, Sun Y, Dhaliwal JS, Uniacke J, Arragain S, Jiang H, Gold ND, Martin VJJ, Lemaire SD, Zerges W.","PLoS One. 2018 Feb 26;13(2):e0185039. doi: 10.1371/journal.pone.0185039. eCollection 2018.","Zhan Y","PLoS One","2018","2018/02/27","PMC5826530","","10.1371/journal.pone.0185039"
"27415754","Gene Regulation in Developing Chloroplasts Disentangled","Zerges W.","PLoS Genet. 2016 Jul 14;12(7):e1006173. doi: 10.1371/journal.pgen.1006173. eCollection 2016 Jul.","Zerges W","PLoS Genet","2016","2016/07/15","PMC4945088","","10.1371/journal.pgen.1006173"
"31591163","Photosystem Biogenesis Is Localized to the Translation Zone in the Chloroplast of Chlamydomonas","Sun Y, Valente-Paterno M, Bakhtiari S, Law C, Zhan Y, Zerges W.","Plant Cell. 2019 Dec;31(12):3057-3072. doi: 10.1105/tpc.19.00263. Epub 2019 Oct 7.","Sun Y","Plant Cell","2019","2019/10/09","PMC6925001","","10.1105/tpc.19.00263"
"23129655","Biogenic membranes of the chloroplast in Chlamydomonas reinhardtii","Schottkowski M, Peters M, Zhan Y, Rifai O, Zhang Y, Zerges W.","Proc Natl Acad Sci U S A. 2012 Nov 20;109(47):19286-91. doi: 10.1073/pnas.1209860109. Epub 2012 Nov 5.","Schottkowski M","Proc Natl Acad Sci U S A","2012","2012/11/07","PMC3511122","","10.1073/pnas.1209860109"
"24312109","Thylakoid biogenesis has joined the new era of bacterial cell biology","Nickelsen J, Zerges W.","Front Plant Sci. 2013 Nov 13;4:458. doi: 10.3389/fpls.2013.00458. eCollection 2013.","Nickelsen J","Front Plant Sci","2013","2013/12/07","PMC3826073","","10.3389/fpls.2013.00458"
"19164529","Chloroplast protein targeting involves localized translation in Chlamydomonas","Uniacke J, Zerges W.","Proc Natl Acad Sci U S A. 2009 Feb 3;106(5):1439-44. doi: 10.1073/pnas.0811268106. Epub 2009 Jan 21.","Uniacke J","Proc Natl Acad Sci U S A","2009","2009/01/24","PMC2629442","","10.1073/pnas.0811268106"
"23424285","Reciprocal regulation of protein synthesis and carbon metabolism for thylakoid membrane biogenesis","Bohne AV, Schwarz C, Schottkowski M, Lidschreiber M, Piotrowski M, Zerges W, Nickelsen J.","PLoS Biol. 2013;11(2):e1001482. doi: 10.1371/journal.pbio.1001482. Epub 2013 Feb 12.","Bohne AV","PLoS Biol","2013","2013/02/21","PMC3570535","","10.1371/journal.pbio.1001482"
"18055604","Photosystem II assembly and repair are differentially localized in Chlamydomonas","Uniacke J, Zerges W.","Plant Cell. 2007 Nov;19(11):3640-54. doi: 10.1105/tpc.107.054882. Epub 2007 Nov 30.","Uniacke J","Plant Cell","2007","2007/12/07","PMC2174875","","10.1105/tpc.107.054882"
"18710928","Stress induces the assembly of RNA granules in the chloroplast of Chlamydomonas reinhardtii","Uniacke J, Zerges W.","J Cell Biol. 2008 Aug 25;182(4):641-6. doi: 10.1083/jcb.200805125. Epub 2008 Aug 18.","Uniacke J","J Cell Biol","2008","2008/08/20","PMC2518703","","10.1083/jcb.200805125"
"27379123","The RNA Structure of cis-acting Translational Elements of the Chloroplast psbC mRNA in Chlamydomonas reinhardtii","Rahim MM, Vigneault F, Zerges W.","Front Plant Sci. 2016 Jun 14;7:828. doi: 10.3389/fpls.2016.00828. eCollection 2016.","Rahim MM","Front Plant Sci","2016","2016/07/06","PMC4906055","","10.3389/fpls.2016.00828"
"18384239","Global expression profiling of Chlamydomonas reinhardtii exposed to trace levels of free cadmium","Simon DF, Descombes P, Zerges W, Wilkinson KJ.","Environ Toxicol Chem. 2008 Aug;27(8):1668-75. doi: 10.1897/07-649.1.","Simon DF","Environ Toxicol Chem","2008","2008/04/04","","","10.1897/07-649.1"
"12369632","Light activates binding of membrane proteins to chloroplast RNAs in Chlamydomonas reinhardtii","Zerges W, Wang S, Rochaix JD.","Plant Mol Biol. 2002 Oct;50(3):573-85. doi: 10.1023/a:1020246007858.","Zerges W","Plant Mol Biol","2002","2002/10/09","","","10.1023/a:1020246007858"
"23728819","Transcriptome sequencing (RNA-seq) analysis of the effects of metal nanoparticle exposure on the transcriptome of Chlamydomonas reinhardtii","Simon DF, Domingos RF, Hauser C, Hutchins CM, Zerges W, Wilkinson KJ.","Appl Environ Microbiol. 2013 Aug;79(16):4774-85. doi: 10.1128/AEM.00998-13. Epub 2013 May 31.","Simon DF","Appl Environ Microbiol","2013","2013/06/04","PMC3754720","","10.1128/AEM.00998-13"
"12045185","Characterization of Tbc2, a nucleus-encoded factor specifically required for translation of the chloroplast psbC mRNA in Chlamydomonas reinhardtii","Auchincloss AH, Zerges W, Perron K, Girard-Bascou J, Rochaix JD.","J Cell Biol. 2002 Jun 10;157(6):953-62. doi: 10.1083/jcb.200201060. Epub 2002 Jun 3.","Auchincloss AH","J Cell Biol","2002","2002/06/05","PMC2174033","","10.1083/jcb.200201060"
"12663530","Multiple translational control sequences in the 5' leader of the chloroplast psbC mRNA interact with nuclear gene products in Chlamydomonas reinhardtii","Zerges W, Auchincloss AH, Rochaix JD.","Genetics. 2003 Mar;163(3):895-904. doi: 10.1093/genetics/163.3.895.","Zerges W","Genetics","2003","2003/03/29","PMC1462503","","10.1093/genetics/163.3.895"
